{
  "schemaVersion": 1,
  "distribution": "full",
  "guidance": {
    "version": 24,
    "backfillStatus": "completed"
  },
  "developerChangelog": "required",
  "releaseNoteGrouping": "product-areas",
  "majorReleaseNaming": "named",
  "signatures": "agent-and-timestamp",
  "newReleaseNoteSurfaces": "ask",
  "mobileReleaseNotePlacement": "mobile-only"
}
